{
  "schema_version": 1,
  "orly_version": "0.14.4",
  "packs": [
    "domain.auth",
    "domain.changelog",
    "domain.documentation",
    "domain.http",
    "domain.sql",
    "language.go",
    "language.javascript",
    "language.mdx",
    "language.python",
    "language.rust",
    "language.shell",
    "language.typescript",
    "language.zig",
    "persona.indy",
    "product.agentsfleet",
    "universal.authoring",
    "workflow.governance",
    "workflow.specifications"
  ],
  "commands": {
    "conform": [
      [
        "make",
        "conform"
      ]
    ],
    "verify.unit": [
      [
        "bun",
        "test",
        "src"
      ]
    ]
  },
  "surfaces": {
    "user": [
      "src/",
      "bin/"
    ],
    "docs": [
      "README.md",
      "docs/"
    ]
  },
  "managed": [
    "AGENTS.md"
  ],
  "digests": {
    "AGENTS.md": "sha256:a421530edc73257aea52207df1109e4c1f0778d14e01c4926858f1aff7672d1e"
  }
}
