{
  "schema_version": 1,
  "orly_version": "0.10.14",
  "packs": [
    "universal.authoring",
    "language.zig",
    "language.typescript",
    "language.javascript",
    "language.rust",
    "language.go",
    "language.python",
    "language.shell",
    "language.mdx",
    "domain.sql",
    "domain.http",
    "domain.auth",
    "domain.documentation",
    "domain.changelog",
    "workflow.specifications",
    "workflow.governance",
    "product.agentsfleet",
    "persona.indy"
  ],
  "commands": {
    "conform": [
      [
        "make",
        "conform"
      ]
    ],
    "verify.unit": [
      [
        "bun",
        "test",
        "src"
      ]
    ]
  },
  "surfaces": {
    "user": [
      "src/",
      "bin/"
    ],
    "docs": [
      "README.md",
      "docs/"
    ]
  },
  "managed": [
    "AGENTS.md"
  ],
  "digests": {
    "AGENTS.md": "sha256:a6186273737b5bf81a706d509cce1806e477a9ac05d70913693b61f3ef166d83"
  }
}
