{
  "schema_version": 1,
  "orly_version": "0.10.14",
  "packs": [
    "universal.authoring",
    "language.rust",
    "domain.http",
    "domain.auth",
    "domain.documentation",
    "domain.changelog",
    "workflow.specifications",
    "workflow.skills"
  ],
  "commands": {},
  "managed": [
    ".agents/skills/orly-babysit-prs/SKILL.md",
    ".agents/skills/orly-spec-new/SKILL.md",
    ".agents/skills/orly-write-integration-test/SKILL.md",
    ".agents/skills/orly-write-unit-test/SKILL.md",
    ".claude/skills/orly-babysit-prs/SKILL.md",
    ".claude/skills/orly-spec-new/SKILL.md",
    ".claude/skills/orly-write-integration-test/SKILL.md",
    ".claude/skills/orly-write-unit-test/SKILL.md",
    ".githooks/pre-commit",
    ".githooks/pre-push",
    ".opencode/skills/orly-babysit-prs/SKILL.md",
    ".opencode/skills/orly-spec-new/SKILL.md",
    ".opencode/skills/orly-write-integration-test/SKILL.md",
    ".opencode/skills/orly-write-unit-test/SKILL.md",
    "AGENTS.orly.md",
    "audits/doc-read.sh",
    "audits/logging.sh",
    "audits/msid-ui.sh",
    "audits/rule-ledger-lib.sh",
    "audits/rust-error.sh",
    "audits/spec-template.sh",
    "audits/spec-template.ts",
    "audits/ufs.sh",
    "dispatch/lib.sh",
    "dispatch/lifecycle.md",
    "dispatch/name_architecture.md",
    "dispatch/write_any.md",
    "dispatch/write_any.sh",
    "dispatch/write_auth.md",
    "dispatch/write_changelog.md",
    "dispatch/write_documentation.md",
    "dispatch/write_http.md",
    "dispatch/write_pr_description.md",
    "dispatch/write_rust.md",
    "dispatch/write_rust.sh",
    "dispatch/write_spec.md",
    "docs/CHANGELOG_VOICE.md",
    "docs/DOCUMENTATION_RULES.md",
    "docs/RELEASE_TEMPLATE.md",
    "docs/REST_API_DESIGN_GUIDELINES.md",
    "docs/TEMPLATE.md",
    "docs/greptile-learnings/RULES.md"
  ],
  "digests": {
    ".agents/skills/orly-babysit-prs/SKILL.md": "sha256:b44216c2f1721bd22247ada9d181379e5b870881ac48cfa32718af8f88dc8cf7",
    ".agents/skills/orly-spec-new/SKILL.md": "sha256:70050617eeabaf0b6f79479546d37da98ea13a81aef0d4dd5d8ea0c9d42dd1b6",
    ".agents/skills/orly-write-integration-test/SKILL.md": "sha256:2379ff10eea85726d9d42cc35b9828d6a07af548eddec887bbd8668d8f19497d",
    ".agents/skills/orly-write-unit-test/SKILL.md": "sha256:5fdcc65e24543b7535ada714e91f5effd56daede4d9fe06d97dc3a3ad882803b",
    ".claude/skills/orly-babysit-prs/SKILL.md": "sha256:b44216c2f1721bd22247ada9d181379e5b870881ac48cfa32718af8f88dc8cf7",
    ".claude/skills/orly-spec-new/SKILL.md": "sha256:70050617eeabaf0b6f79479546d37da98ea13a81aef0d4dd5d8ea0c9d42dd1b6",
    ".claude/skills/orly-write-integration-test/SKILL.md": "sha256:2379ff10eea85726d9d42cc35b9828d6a07af548eddec887bbd8668d8f19497d",
    ".claude/skills/orly-write-unit-test/SKILL.md": "sha256:5fdcc65e24543b7535ada714e91f5effd56daede4d9fe06d97dc3a3ad882803b",
    ".opencode/skills/orly-babysit-prs/SKILL.md": "sha256:b44216c2f1721bd22247ada9d181379e5b870881ac48cfa32718af8f88dc8cf7",
    ".opencode/skills/orly-spec-new/SKILL.md": "sha256:70050617eeabaf0b6f79479546d37da98ea13a81aef0d4dd5d8ea0c9d42dd1b6",
    ".opencode/skills/orly-write-integration-test/SKILL.md": "sha256:2379ff10eea85726d9d42cc35b9828d6a07af548eddec887bbd8668d8f19497d",
    ".opencode/skills/orly-write-unit-test/SKILL.md": "sha256:5fdcc65e24543b7535ada714e91f5effd56daede4d9fe06d97dc3a3ad882803b",
    "AGENTS.orly.md": "sha256:18b4efcd50983e633475a701cb7d2dde0a69da4c686fcafb103e4928f2fe5013",
    "audits/doc-read.sh": "sha256:8177610ec3f513c17d09e30b1977a06c1662984ba03af75da93b7ed1098ce8c0",
    "audits/logging.sh": "sha256:42ba99ad475b48ab063af2c206f0063c9ec6093270dd00eeec298d9a7d2c5bbc",
    "audits/msid-ui.sh": "sha256:2e8b5ceb27d381eccabc5cf26ce313b7b7eb46bcac6907c0e503b4f104f3bb6d",
    "audits/rule-ledger-lib.sh": "sha256:e2b03f8b9496a3d60412394eab16d9806c3db786be9dd0493a1ef80f2c37e446",
    "audits/rust-error.sh": "sha256:156ae901f5ecf75dc26202c0bb15eead1d2c2c851544ad356e1e2e363cfcde1b",
    "audits/spec-template.sh": "sha256:1bb6ca97316103dd335d6a6b7212be921432668d746662c23546f42367cda3c6",
    "audits/spec-template.ts": "sha256:0f652872d2929397c501a90d6d5e83cc4a4d52f314b3ed0d0347f03eb6a76c9f",
    "audits/ufs.sh": "sha256:c0e86a4affea143f786b5b9f3d09e014707948346dc7cb49c5f086f67ddf3054",
    "dispatch/lib.sh": "sha256:a85348befc7dc1dd6d5c31e5269fd7ac323cb4b8605526950eb1d5f4922cefdf",
    "dispatch/lifecycle.md": "sha256:c52bcd877df5e03ee558c68b7858f26756aaa03c2f6948d3aa4502ea81399c1e",
    "dispatch/name_architecture.md": "sha256:7fe21a8aef2c86c572d122671fcea69ce07d364d4d8151847bb594f9316b74ff",
    "dispatch/write_any.md": "sha256:5846c57173e5010ecda1abcfffbcd4e6f275fdc4a253373f1db21c414e3324d6",
    "dispatch/write_any.sh": "sha256:92ad9b8ea25a5f0e5e12be0a13cf3dab4a628e6fbf23bfd34f79dc3bf527a4f4",
    "dispatch/write_auth.md": "sha256:49e60ef4e89d1020a6062fe5aa9ba939d7cdf6589c3d93a58f2fb1a87095cc2f",
    "dispatch/write_changelog.md": "sha256:9cbf92676c884061eb2206d361fb4639175fa381ba99d42f3c395c7109845832",
    "dispatch/write_documentation.md": "sha256:3f4d481e3a19396fae0ba133c7c7e13d8a80ee0aa6ef04ac8ff9070a6b988587",
    "dispatch/write_http.md": "sha256:e6f164a7948350ec849e2a067105bd5eec9bb7549afea97de1dc348d00245f62",
    "dispatch/write_pr_description.md": "sha256:2e1a91b09e98faa0971968092b53be8d087c617fc1b9afb267b2deeccc5372e0",
    "dispatch/write_rust.md": "sha256:880f5c06df766fcca9edb2a887fae3824331f072d04355ed98cdc4c4314df4bd",
    "dispatch/write_rust.sh": "sha256:f6f3b5d136453f2f3247db268aa59b0f4467f7cf844d71619a2436aac8df0374",
    "dispatch/write_spec.md": "sha256:b635824d48a08da98f85c6cca265e680a989c9e76f000fee1fde740b302afb18",
    "docs/CHANGELOG_VOICE.md": "sha256:96664296e40e49b30215625922dc958b067aab14434fc1e5812b24259bc12307",
    "docs/DOCUMENTATION_RULES.md": "sha256:8dc4a473abd544728e2d43a0be599b8d4bfe4cc323e6f851aac38c302b2885ec",
    "docs/greptile-learnings/RULES.md": "sha256:dfe4196f7c510a9a8ba2dc9a28cbedaf5813198365fc16ac533111e1606604fe",
    "docs/RELEASE_TEMPLATE.md": "sha256:25c181f0cce43216447e4d19b9ba7bacf5fe0098a6bdbd698b2939afa2bf682d",
    "docs/REST_API_DESIGN_GUIDELINES.md": "sha256:114e8a1c1968bae539812ceec417690abf99c761b4bb83c541bb24cdd9095ee5",
    "docs/TEMPLATE.md": "sha256:a2b3ff973eedc18efee0a2b96041121cef5a68aca67cd74804ff5979d8db4b22"
  }
}
